"Location Code","Location ID","Company","Address Line 1","Added By","Note Date","Note Time","Note Code","Note"
"110743","9213","REGINE'S","1896 3RD AVE NEW YORK 10029","CAROLINE","04/01/2024","12:43:00","OFFICE","SPOKE TO WILLIAM WILFRED, HE STATED HE WILL DEPOSIT MONEY INTO LIBERTYS ACCOUNT I EMAILED HIM LIBERTYS ACH FORM  SO FOR HIS 5 ACTIVE REOCCURRING MONTHLY ACCOUNTS AND HIS 3 OTHER LOCATIONS THAT ARE CANCELLED AND JUST CHERRY ACCOUNTS MONEY CAN BE DEPOSITED INSTEAD OF COD , AS OF NOW CUSTOMER PAYING COD UNTIL I GET HIS CONFIRMATION OTHERWISE"
"110742","9015","REGINE'S","170 EAST 116TH ST NEW YORK 10029","CAROLINE","04/01/2024","12:43:00","OFFICE","SPOKE TO WILLIAM WILFRED, HE STATED HE WILL DEPOSIT MONEY INTO LIBERTYS ACCOUNT I EMAILED HIM LIBERTYS ACH FORM  SO FOR HIS 5 ACTIVE REOCCURRING MONTHLY ACCOUNTS AND HIS 3 OTHER LOCATIONS THAT ARE CANCELLED AND JUST CHERRY ACCOUNTS MONEY CAN BE DEPOSITED INSTEAD OF COD , AS OF NOW CUSTOMER PAYING COD UNTIL I GET HIS CONFIRMATION OTHERWISE"
"139649","66681","NAIMOR DELI","6701 Forest Ave Ridgewood 11385","ANTHONY C.","04/01/2024","12:43:00","OFFICE","RESENT PROPOSAL"
"135851","62900","MR. P'S HOMEMADE ICE CREAM","1397 Nostrand Ave Brooklyn 11226","BRANTON D.","04/01/2024","12:43:35","SERVICE","Service: PEST ELIM MAINT General service inspected all common areas throughout the basement areas,checked for rodent activity. Spray treated perimeter bathrooms and kitchen areas prep station. Behind counter area. Sitting area, changed glue boards. Signed DOH Form and took a picture"
"110741","9447","REGINE'S","WILFRED WILLIAMS NEW YORK 10029","CAROLINE","04/01/2024","12:44:00","OFFICE","SPOKE TO WILLIAM WILFRED, HE STATED HE WILL DEPOSIT MONEY INTO LIBERTYS ACCOUNT I EMAILED HIM LIBERTYS ACH FORM  SO FOR HIS 5 ACTIVE REOCCURRING MONTHLY ACCOUNTS AND HIS 3 OTHER LOCATIONS THAT ARE CANCELLED AND JUST CHERRY ACCOUNTS MONEY CAN BE DEPOSITED INSTEAD OF COD , AS OF NOW CUSTOMER PAYING COD UNTIL I GET HIS CONFIRMATION OTHERWISE"
"119561","45742","REGINES","589 E 138th St Bronx 10454","CAROLINE","04/01/2024","12:44:00","OFFICE","SPOKE TO WILLIAM WILFRED, HE STATED HE WILL DEPOSIT MONEY INTO LIBERTYS ACCOUNT I EMAILED HIM LIBERTYS ACH FORM  SO FOR HIS 5 ACTIVE REOCCURRING MONTHLY ACCOUNTS AND HIS 3 OTHER LOCATIONS THAT ARE CANCELLED AND JUST CHERRY ACCOUNTS MONEY CAN BE DEPOSITED INSTEAD OF COD , AS OF NOW CUSTOMER PAYING COD UNTIL I GET HIS CONFIRMATION OTHERWISE"
"133093","60150","Della","66 W Broadway New York 10007","MORELL","04/01/2024","12:46:23","SERVICE","Service: PEST ELIM MAINT Conducted service throughout all areas of restaurant. Placed Nuvan fly strip behind bar. Applied spot treatment to perimeter of all areas. Applied aerosol treatment behind the bar to help combat against fly activity. No rodent activity discovered. Inspection completed"
"115137","40343","410 WEST 25TH STRET OWNERS CORP","410 W 25th St New York 10001","LORA R.","04/01/2024","12:47:08","SERVICE","Service: PEST ELIM MAINT Service Treated:  Apt Listed on the Service Ticket   Kitchen Area,Bathroom,Boiler Room,Laundry Room,Electrical Room,Painter Room  Sprayed all common areas, Drains   Place a couple of Glueboards Down   Performed Ipm, RnR"
"110910","9556","THE BOWERY HOTEL","335 BOWERY NEW YORK 10003","CAROLINE","04/01/2024","12:53:00","OFFICE","CALLED KIRK WILSON GM  NO ANSWER , EMAILED ALL EMAILS ON FILE"
"137976","65019","GOLDEN SANDS CAFE","1924 Avenue U Brooklyn 11229","RIVERA M.","04/01/2024","12:53:40","SERVICE","Service: EVALUATION Inspection and service were provided at this location for rodents activity.   I drilled 5 holes around the basement and dust in all . See photos.   I placed 5 rtu boxes and 8 mice snaps    IPM    I am recommending 5 ketchal boxes for the basement area.   I signed doh log. Jonny is very happy with the service that was provided today."
"101420","1234","HEALTH TREASURES","8512 20th Ave Brooklyn 11214","GHEIDA J.","04/01/2024","12:54:30","SERVICE","Service: PEST ELIM MAINT Customer refused service because they were celebrating with a lot of food out."
"121670","47846","MIDDLE VILLAGE ADULT CENTER","6910 75th St Middle Village 11379","ROSE","04/01/2024","12:55:00","OFFICE","RECEIVED TAX EXEMPT CERTIFICATE ATTACHED TO DOCUMENTS"
"139981","67010","ARUNE","13736 159th St Jamaica 11434","SEBAHAT","04/01/2024","12:56:00","OFFICE","EMAILED CREDIT CARD TO SET UP A MICE SERVICE, IF HE CALLS PLEASE FOWARD"
"110991","9343","THE GREAT GEORGIANI","248 DEKALB AVE BROOKLYN 11205","CAROLINE","04/01/2024","12:58:00","OFFICE","WONT CALL CUSTOMER ALREADY ON CC AUTO BILL"
"137476","64519","EASTSIDE STORY RESTAURANT","265 E 10th St New York 10009","ANTHONY C.","04/01/2024","12:58:00","OFFICE","CALLED TEXTED AND EMAILED LOCATION WAITING TO HEAR BACK, OBTAINED ACCESS"
"130365","57437","Metropolitan Drugs","1873 2nd Ave New York 10029","CORA JOSE","04/01/2024","12:59:08","SERVICE","Service: PEST ELIM MAINT Inspected and treated front of store. Front counter area. Bathrooms. Storage area. All common areas. Sprayed b and g transport, Tekko. Checked all bait stations. Checked ketchall. Checked t-Rex. Checked rtu’s. Changed bait and glue boards. Sign doh."
"139966","66996","FIONAS HOUSE","559 86th St Brooklyn 11209","NICOLE.P","04/01/2024","13:00:00","OFFICE","NEW AUTO - RICH CARRION"
"132435","59500","Sanford Community Pharmacy Corp.","1041 S Orange Ave Newark 07106","FORD J.","04/01/2024","13:01:51","SERVICE","Service: PEST ELIM MAINT Inspected and treated the pharmacy,aisles, bathroom, basement and common areas. Sprayed BandG transport and nyguard plus gel bait in cracks and crevices. Changed bait and glue boards. Checked all bait stations and ketchalls and tincats. Treated holes and voids with tracking powder. I caught 2 mice by the back door."
"106785","5539","YOUNG ISRAEL OF FORREST HILLS","68-07 BURNS ST FOREST HILLS 11375","FERNANDEZ","04/01/2024","13:02:20","SERVICE","Service: PEST ELIM MAINT General service treated basement kitchen and center perimeter placed glue boards in basement checked lps no activity on monitors or bait stations updated doh"
"139979","67008","JODIANS HOME","11843 189TH STREET ST ALBANS 11412","CAROLINE","04/01/2024","13:04:00","OFFICE","GOT JODIANS CREDIT CARD INFO"
"122297","48467","BROOKLYN WALDORF SCHOOL","11 Jefferson Ave Brooklyn 11238","ROSE","04/01/2024","13:04:00","OFFICE","SPOKE TO COREY HE WILL SEND ME THE TAX EXEMPT CERTIFICATE"
"113118","10924","HAN DYNASTY","215 WEST 85TH ST NEW YORK 10024","GREG","04/01/2024","13:08:00","OFFICE","Hi Team, Please see Albert's notes below. Based on his evaluation the cost of the rodent proofing service is $500.00. This includes all material, workkkkmanshipÂ and a 6 month warranty. Please let me know if you'd like to proceed and I will be glad to schedule"
"139179","66217","UNCLE VITO'S BISTRO","1133 73rd St Brooklyn 11228","RICHCOLUCI","04/01/2024","13:08:22","OFFICE","ON HOLD TILL LATER TODAY. No one is here and couldn't reach anyone on listed number. This is a private residence not a bistro!  Will try to contact Vito later on today. Rc."
"125835","52960","TOVLI WAREHOUSE","127 Frelinghuysen Ave Newark 07114","SUTTON J.","04/01/2024","13:12:27","SERVICE","Service: PEST ELIM MAINT Inspected the perimeter and found activity LP,'s on the outside I checked and serviced 2 Bait stations no activity and 20 LP's and serviced 8 with first strike soft bait l Iocated doh signed and took picture"
"131289","58357","Milford llc","452 W 163rd St New York 10032","JOSEPH MAC","04/01/2024","13:18:35","SERVICE","Service: PEST ELIM MAINT General service all common area service available apts treated for roaches and rodents sprayed perimeter glue boards"
"124533","51683","VITOS ITALIAN DELI","806 WASHINGTON STREET HOBOKEN 07030","GHANIM MO","04/01/2024","13:18:39","SERVICE","Service: PEST ELIM MAINT Serviced and inspected all areas dusted all necessary areas with tracking powder replenished rat snaps removed 2 baby rat from 1 st side basement rat snaps inspected and dusted arch void in condo side basement updated doh log"
"139719","66751","TOP TASTE JAMAICA RESTAURANT","559 Chancellor Ave Irvington 07111","ANTHONY C.","04/01/2024","13:19:00","OFFICE","WELCOMED RACINE TO TEAM LIBERTY EMAILED LAST REPORT UPON HER REQUEST"
"122592","48759","Glenmore Plaza Senior Center","460 DUMONT AVENUE BROOKLYN 11212","ROSE","04/01/2024","13:20:00","OFFICE","SPOKE TO ALEXIS , ATTACHED TAX EXEMPT CERTIFICATE."
"127973","55080","Citi Express Pharmacy And Medical","4217 Church Ave Brooklyn 11203","BRANTON D.","04/01/2024","13:23:18","SERVICE","Service: PEST ELIM MAINT General service inspected all common areas throughout basement area and pharmacy,checked rodent devices,no activity found. Changed glue boards throughout basement area,spray treated bathrooms and storage areas boiler room perimeter baseboards,closets and isles. Behind counters,signed DOH Form and took a picture"
"139179","66217","UNCLE VITO'S BISTRO","1133 73rd St Brooklyn 11228","RICHCOLUCI","04/01/2024","13:23:24","OFFICE","DEAD DEAL. Just spoke with Vito. See previous note. He was very nice and said he doesn't need any more services, probably selling house soon. I got his credit card info for past services rendered and calling accounting now to give them. Rc."
"131508","58575","Heart Share","14216 168th St Jamaica 11434","KNEE JR.","04/01/2024","13:26:15","SERVICE","Service: PEST ELIM MAINT There is a new number for this location 168 residents - 7185270806  Please Update contact information   General service rodents and roaches I sprayed around all the rooms , kitchen , bathrooms , laundry room , bed rooms upstairs , downstairs , There is no activity at this time I’ll continue to monitor checked and replaced monitoring devices"
"139953","66983","NEXUS CLUB","100 Church St New York 10007","ANTHONY M.","04/01/2024","13:28:17","OFFICE","Met with Jose who in turn has to present pricing discussed to his manager for approval"
"139509","66542","IZAKAYA TENZO","1116 Bedford Ave Brooklyn 11216","ANTHONY C.","04/01/2024","13:32:00","OFFICE","CALLED ACCOUNT WELCOMED TO THE TEAM CONFIRMED DATE AND TIME OF NEXT SERVICE"
"139797","66828","FOREFEATHERS","347 3rd Ave New York 10010","JOHNI","04/01/2024","13:33:00","OFFICE","sent email This is to inform you that your initial pest control service is scheduled for Friday, April 5th, arriving between 1030am and 1230pm. Please confirm that this works for you. Thank you for choosing Liberty pest Control John Iachello Scheduling Dept Liberty Pest Control"
"126422","53545","SUNSET PARK PHARMACY","4510 5TH AVE BROOKLYN 11220","BAEZ MALIK","04/01/2024","13:34:44","SERVICE","Service: PEST ELIM MAINT General service   Treated common areas   Perimeter spray   Spot treatment   Replaced glue boards   Updated doh log   IPM"
"115128","40334","SID GOLD REQUEST ROOM","165 W 26th St New York 10001","LORA R.","04/01/2024","13:35:45","SERVICE","Service: PEST ELIM MAINT Service Treated   Bar Area,Lounge AreaFront and back,Stage Area,Bathroom’s,Basement Area,Locker Area,Kitchen Area, Prep Area, Dishwasher Area,Office Area,Storage Area   Checked all Traps no activity found   Sprayed all common areas, Drains   Place a couple of Glueboards Down   Performed Ipm, RnR"
"139821","66852","P.S. KITCHEN","246 w 48th St New York 10036","ANTHONY C.","04/01/2024","13:36:00","OFFICE","SPOKE WITH TIM , SO FAR SO GOOD"
"133012","60069","SC MANAGEMENT","3 W 57th St New York 10019","LOPEZ A.","04/01/2024","13:40:31","OFFICE","Recommending service twice a month so we could get the issues under control. So sealing up all the radiators gaps."
"139876","66907","THE NORWEGIANS SEAMAN CHURCH of ny","317 E 52nd St New York 10022","ANTHONY C.","04/01/2024","13:41:00","OFFICE","CLM FOR GOY WELCOMING THE ACCOUNT TO TEAM LIBERTY"
"132740","59800","LAFI ABDELJABER","133 Monroe St Garfield 07026","TRISHA H.","04/01/2024","13:42:00","OFFICE","Riya Attachments 10:16â€¯AM (3 hours ago) to Liberty, Miriam, me  Hello, Also, kindly change the service into quarterly please, if. possible."
"110070","9821","MORIAH ADULT LUNCHEON","90 BENNETT AVE NEW YORK 10033","VALERA F.","04/01/2024","13:42:56","SERVICE","Service: PEST ELIM MAINT Serviced 3 trap ketchalls and were inactive.  Spot treatment on baseboards, kitchen, food prep room, basement , bathrooms, storage room, maintenance storage area and office.  Replaced glue boards in basement .  Updated doh log (see photo)  IPM, RNR."
"101765","1733","SSEC RAICES","107-24 CORONA AVE CORONA 11368","FERNANDEZ","04/01/2024","13:43:01","SERVICE","Service: PEST ELIM MAINT General service treated basement kitchen and center perimeter placed glue boards through out no activity seen updated doh"
"139906","66937","MAIMONI GOURMET DELI AND GRILL","4906 FORT HAMILTON PKWY BROOKLYN 11220","BAEZ MALIK","04/01/2024","13:44:59","SERVICE","Service: NEW ACCT SVCE Played bait in basement ceiling   Snap’s threwout basement   Dusted burrow in basement drain pit   Placed glue boards threwout   Perimeter spray   Spot treatment   Gelled behind deli   ipm"
"113706","11747","LIPS","227 EAST 56TH ST NEW YORK 10022","VIZCARANDO","04/01/2024","13:47:07","SERVICE","Service: PEST ELIM MAINT GENERAL SERVICE:I SPOT TREATED THE LOUNGE AREA AND BATHROOM I ALSO SPOT TREATED THE KITCHEN AND BEHIND THE BAR AREA AND I GELD THE KITCHEN AREA I SPOT TREATED THE DRESSING ROOMS AND PUT DOWN GLUE BOARDS  I ALSO SPOT TREATED AROUND THE GARBAGE AREA I CHECKED ALL THE KETCH-ALL AND THEY WERE CLEAN.  I ALSO UPDATED THE DOH-LOG IPM RNR"
"132484","59549","SPICY MOON","328 E 6th St New York 10003","MARCO C","04/01/2024","13:49:00","OFFICE","Chris Miceli spoke to location and  key for basement is being left on the lava lamp"
"133423","60480","Pizza","797 5th Ave Brooklyn 11232","JOE P.","04/01/2024","13:50:00","OFFICE","spoke to carmine a few times said he was sending it out weeks ago"
"135564","62618","Milford llc","450 W 163rd St New York 10032","JOSEPH MAC","04/01/2024","13:50:07","SERVICE","Service: PEST ELIM MAINT General service all common area service available apts treated for roaches and rodents sprayed perimeter glue boards"
"133598","60655","SAMIR REALTY LLC","1223 WOODYCREST AVE BRONX 10452","ANTHONY C.","04/01/2024","13:51:00","OFFICE","SPOKE WITH SHAH WELCOMED ACCOUNT TO THE TEAM"
"120953","47130","HOUSE OF QUE","340 SINATRA DR HOBOKEN 07030","MARCO C","04/01/2024","13:52:00","OFFICE","this key no duplicate. Harvey jones has the key"
"137712","64755","HARLEM'S OWN WINE AND LIQUOR","314 E 106th St New York 10029","TRISHA H.","04/01/2024","13:53:00","OFFICE","AS PER CHRIS M CHANGED PRICE TO $65.00 PLUS TAX WHICH MADE THE MONTHLY PRICE $70.77. Also changed price on greenpay."
"139912","66943","RESIDENCE","1049 Madison Ave Paterson 07501","ANTHONY C.","04/01/2024","13:54:00","OFFICE","SPOKE WITH JOSE WELCOMED HIM TO THE TEAM"
"111210","9783","Roth & Cohen Realty LLC","2850 SHORE PARKWAY BROOKLYN 11235","CAROLINE","04/01/2024","13:55:00","OFFICE","SPOKE TO ACCOUNTS PAYABLE SHE STATED MAYBE ACH SHE WILL DO  SHE HAS TO SPEAK TO HER BANK, I EMAILED HER BOTH FORMS, I WILL FOLLOW UP"
"129660","56744","LIEVIETO PIZZA","584 Summit Ave Jersey City 07306","ANTHONY C.","04/01/2024","13:57:00","OFFICE","SPOKE WITH YOUNG LADY RE RECENT SERVICE EVERYTHING IS FINE"
"139367","66402","SILVERSTONE PROPERTY MANEGMENT","4160 Main St Flushing 11355","ANTHONY C.","04/01/2024","13:59:00","OFFICE","CLM WITH VESSA WELCOMING ACCOUNT TO TEAM LIBERTY"
"111677","12908","SVG CARRIBBEAN BAKERY & RESTAURANT","1621 NOSTRAND AVE BROOKLYN 11226","BRANTON D.","04/01/2024","13:59:15","SERVICE","Service: PEST ELIM MAINT General service inspected all common areas throughout the basement areas,checked rodent devices.dead mouse in ketchal station under stove, dusted under shelves by door,changed glue boards. Placed snap traps. Spray treated perimeter bathrooms and storage areas boiler room behind counters,and under appliances,signed DOH Form and took a picture"
"133416","60473","ANGEL AZUL BAKERY CAFE","460 Central Ave Jersey City 07307","GHANIM MO","04/01/2024","13:59:26","SERVICE","Service: PEST ELIM MAINT Checked in with staff serviced and inspected all areas sprayed all necessary areas gel cracks and crevices checked and reset ketchalls no activity in ketchalls replenished monitoring boards updated doh log"
"114260","39466","SHIP WRECKED MINI GOLF","621 Court St Brooklyn 11231","RIVERA A.","04/01/2024","14:00:56","911 EMER","Can not conduct Services due to holiday and school not being open spoke to the owner and he said he would like to be rescheduled for next Monday or tomorrow"
"116171","41375","Redhook beverages DBA RED HOOK CORP","66 Seabring St Brooklyn 11231","RIVERA A.","04/01/2024","14:01:11","SERVICE","Service: PEST ELIM MAINT Conducting my services throughout Warehouse   Treated all garage areas both sides treated all LP stations and rebated them a first strike  Treated offices bathrooms kitchen areas  Treated offices bathrooms and storage room areas  There were no signs of any mice rodent or insects or roach activities or flies   Treat it all drains and grease traps   Also treated both sides of garage singed the Doh log sheet and my inspection was completed"
"106507","5854","EISMAN DAY NURSERY","1794 1ST AVE NEW YORK 10128","CORA JOSE","04/01/2024","14:01:31","SERVICE","Service: PEST ELIM MAINT Inspected and treated all classrooms. Bathrooms. Kitchen. Offices. Storage closet. Closet. Pantry room. All common areas. Sprayed b and g transport, Tekko. Checked all bait stations. Checked ketchall. Checked tincats. Checked rtu’s. Changed bait and glue boards. Sign doh."
"126471","53591","BAGELS ON THE HUDSON","802 Washington St Ste A Hoboken 07030","EVETTE","04/01/2024","14:02:00","OFFICE","I'm giving Brandon C. A KEY FOR THIS LOCATION"
"116802","42003","GREENTREE PHARMACY","291 7th Ave Brooklyn 11215","NICOLE.P","04/01/2024","14:03:00","OFFICE","REIMBURSED THE 12/30/2024 CHARGE AND SENT THE CUSTOMER THE RECEIPT"
"136776","63820","TAQUERIA EMILIO","3029 Stillwell Ave Brooklyn 11224","RICHCOLUCI","04/01/2024","14:03:15","OFFICE","*DEAD DEAL. Rogelio no longer works here. Spoke with GM, she said that they hired a friend to do past control here now. ***Also mentioned that they were charged for the months of September and October '23 when they were closed. She asked for a reimbursement for those  2 months. Rc."
"131511","58578","Heart Share","15039 120th Ave Jamaica 11434","KNEE JR.","04/01/2024","14:04:36","SERVICE","Service: PEST ELIM MAINT General service rodents and roaches sprayed around each room , basement , upstairs , bathrooms , kitchen , changed and put down new monitoring devices there isn’t much activity except 2 different rooms had water bugs ( American roaches) I treated for and I’ll continue to monitor"
"105873","5447","COLUMBA HALL HDFC","209 EAST 118TH ST NEW YORK 10035","GREG","04/01/2024","14:05:00","OFFICE","CALLED AND LEFT A MESSAGE FOR CANDICE TO CALL ME REGARDING AN UPGRADE"
"122297","48467","BROOKLYN WALDORF SCHOOL","11 Jefferson Ave Brooklyn 11238","ROSE","04/01/2024","14:05:00","OFFICE","RECEIVED TAX EXEMPT CERTIFICATE FROM COREY ATTACHED TO DOCUMENTS"
"139608","66641","CASA ROMERO MEXICAN GRILL & BAR","118 New Market Ave South Plainfield 07080","FORD J.","04/01/2024","14:05:59","SERVICE","Service: NEW ACCT FOLLOW General service. Inspected and treated the kitchen, bathrooms, dining room,prep area,coffee station,bar,storage rooms and common areas. Sprayed BandG transport and nyguard plus gel bait in cracks and crevices. Changed bait and glue boards. Checked all bait stations and tincats. Used aerosols in the drains and to knock down some flies. No droppings found. Signed the doh form."
"139415","66449","Crescent Hotel","4224 Crescent St Long Island City 11101","JOHNI","04/01/2024","14:06:00","OFFICE","Initial has not gone off, and April was generated. I voided inv. and services, lets see if they even accept initial service"
"139062","66101","EAST WIND RESTAURANT","417 7th Ave Brooklyn 11215","CAROLINE","04/01/2024","14:08:00","OFFICE","THIS IS ON MY LIST TO CALL FOR AUTO PAYMENTS AND THIS ACCOUNT IS ALREADY ON ACH"
"139062","66101","EAST WIND RESTAURANT","417 7th Ave Brooklyn 11215","CAROLINE","04/01/2024","14:09:00","OFFICE","THIS IS ON MY LIST TO CALL FOR AUTO PAYMENTS AND THIS ACCOUNT IS ALREADY ON ACH"
"111418","9106","EAST WIND RESTURANT","471 16TH ST BROOKLYN 11215","CAROLINE","04/01/2024","14:09:00","OFFICE","THIS IS ON MY LIST TO CALL FOR AUTO PAYMENTS BUT THIS ACCOUNT IS CANCELLED AND THE 2 OTHER LOCATIONS ASSOCIATED WITH THIS ACCOUNT ARE ON AUTO ACH PAYMENTS 4/1/24"
"132740","59800","LAFI ABDELJABER","133 Monroe St Garfield 07026","JOHNI","04/01/2024","14:10:00","OFFICE","changed service setup to quarterly, deleted this months service"
"116074","41278","MANADO JAZZ LOUNGE","942 Atlantic Ave Brooklyn 11238","ANTHONY M.","04/01/2024","14:10:40","OFFICE","Express"
"113755","11551","ORALE TACOS","23-23 30TH AVE LONG ISLAND CITY 11102","JOE P.","04/01/2024","14:11:00","OFFICE","sent out invoice and cc form left message with worker"
"135214","62270","MILFORD LLC","448 W 163rd St New York 10032","JOSEPH MAC","04/01/2024","14:12:53","SERVICE","Service: PEST ELIM MAINT General service all common area service available apts treated for roaches and rodents sprayed perimeter glue boards"
"139532","66565","SAINT STEVEN OUTREACH DEVELOPMENT","874 Myrtle Ave Brooklyn 11206","ANTHONY C.","04/01/2024","14:14:00","OFFICE","AS PER SHEILA DROPPINGS FOUND  IN KITCHEN PLEASE LET ANTHONY C AT OFFICE  KNOW IF ANY EQUIPMENT NEEDED"
"139445","66478","ANIMO","1004 2nd Ave New York 10022","NICOLE.P","04/01/2024","14:14:00","OFFICE","NEW AUTO - LUIS"
"138063","65106","Adelle","5912 21st Ave Brooklyn 11204","ANTHONY C.","04/01/2024","14:16:00","OFFICE","SPOKE WITH ADELLE ALL GOOD SO FAR  WE WILL BE SERVICING TOMORROW"
"132016","59083","EL PUEBLO QUERIDO MEXICAN","42 Main St South River 08882","LUIS G","04/01/2024","14:16:00","OFFICE","REDUCE TO ONCE A MONTH CUSTOMER DOESNT WANT IT"
"134373","61430","PAULS ON TIMES SQUARE","136 W 42nd St New York 10036","ANTHONY C.","04/01/2024","14:21:00","OFFICE","SPOKE WITH LADY MNGR VERY GOOD RE RECENT FLY SERVICE"
"132016","59083","EL PUEBLO QUERIDO MEXICAN","42 Main St South River 08882","JOHNI","04/01/2024","14:21:00","OFFICE","changed service setup to 1 x per month"
"126579","53699","GEFFEN GOURTMET","407 MILL RD HEWLETT 11557","KNEE C.","04/01/2024","14:23:32","SERVICE","Service: PEST ELIM MAINT General service Robinson roaches arrived at location did a walk-through there’s a hole in one of the kitchen walls were a whole tile used to be it’s the bottom tile with a wall starts the whole thing is missing is a big hole in the wall I stuffed steel wool up into the wall for now I use some of us sticky pads to make a temporary early wool to cover it there’s no activity at the time but if any activity occurs it’s definitely a path that they’re going to take the mice so I’ll continue to monitor and work with the owner in the hopes of closing it up permanently other than that there’s really nothing happening here at this time I updated the DOH"
"130044","57116","RIDGEFIELD PARK DELI & GRILL","419 Main St Ridgefield Park 07660","ANTHONY C.","04/01/2024","14:24:00","OFFICE","CLM FOR TONIA RE RECENT MICE SERVICE"
"135330","62385","MANHATTAN BEACH PIZZA","1623 Oriental Blvd Brooklyn 11235","RICHCOLUCI","04/01/2024","14:24:29","OFFICE","DEAD DEAL. Currently closed. As per previous notes, business was sold to new owners and they use their own pest control company. Mike D. is working on past due balance. Rc."
"122454","48621","TIVOLI TOWER APARTMENTS","49 Crown St Brooklyn 11225","CAPPA T.","04/01/2024","14:24:38","SERVICE","Service: RATS Rebaited all exterior stations  Funnel baited all burrows in soil"
"126786","53906","ESQUIRE MGMNT CORP.","29 Perry St New York 10014","SEBAHAT","04/01/2024","14:25:00","OFFICE","HAROLD THE SUPER WILL CALL ME TO SET UP AN APPOINTMENT. PLEASE FOWARD"
"134616","61672","VANBARTON SERVICES LLC","980 Avenue Of The Americas New York 10018","REPS S.","04/01/2024","14:27:18","SERVICE","Service: NEW ACCT SVCE Met with Ryan and Nicholas. Was shown all areas of concern. Treated floors 1-4. Treated all bathrooms, storage rooms, it closest, mechanical rooms. Also treated all staircases. Definitely roach activity stemming from demo work. Just need to continue to be on top of servicing areas of concern. Also treated all slop sink rooms. Slop sink rooms have most roach activity. Nicholas didn’t need 25 ketchalls, he said it’s unnecessary for them, I explained it’s to have them for preventative measuring. He only wanted 12 installed. Installed 12 ketchalls throughout mechanical rooms. It’s a demolition site so there’s a lot of conducive and cluttered areas. There was a parking lot next door so Igor and i parked at the lot and went to job site together, very crowded area."
"119428","45609","TOWERS CAFE","760 BROADWAY BROOKLYN 11206","MIKE D","04/01/2024","14:29:16","SERVICE","Service: COLLECTION The Owner Andy, is that another location in the Bronx. I’ll follow up this week."
"130384","57456","BUTLER BAKESHOP AND ESPRESSO BAR","177 LAFAYETTE ST NEW YORK 10013","ANTHONY C.","04/01/2024","14:31:00","OFFICE","CLM TO JAMIE RE RECENT RODENT PROOFING"
"133557","60614","Villa Maria","415 Broadway Bayonne 07002","SUTTON J.","04/01/2024","14:34:01","SERVICE","Service: PEST ELIM MAINT Inspected the exterior and interior and found no activity. I sprayed with Gentrol IGR in all common areas I serviced the Restaurant and 3 apt units 4L, 5L, 6R I used hotspot in all drains also checked 5 LPs nothing found no activity the apt units I used roach gel serviced all rtu's with first strike soft bait and monitors located doh signed took picture"
"122644","48811","BUTLER","40 WATER ST BROOKLYN 11201","ANTHONY C.","04/01/2024","14:35:00","OFFICE","CLM RE RECENT RODENT PROOFING"
