"Location Code","Location ID","Company","Address Line 1","Added By","Note Date","Note Time","Note Code","Note"
"135453","62508","SUPER BURRITO","320 Bedford Ave Brooklyn 11249","ANTHONY C.","04/01/2024","09:15:00","OFFICE","Hi Eugene , I hope all is well . Circling back re- flies . Please keep me posted .   Warm Regards, Anthony C."
"139911","66942","R SAKARIA REALTY","1018 Ogden Ave Bronx 10452","SEBAHAT","04/01/2024","09:18:00","OFFICE","IM WAITING ON HAZEL TO CONTACT ME BACK ON WHAT DAY WORKS BEST TO START MONTHLY SERVICE"
"133978","61035","P&S  Bakery and Restaurant","917 Utica Ave Brooklyn 11203","SEBAHAT","04/01/2024","09:21:00","OFFICE","TECH CALLED IN ANS THEY ARE CLOSED, HE TOOK A PICTURE AND IS MOVING FOWARD"
"109130","7194","HUNGARIAN UNITED CONSULATE","227 EAST 52ND ST NEW YORK 10022","PELLICER A","04/01/2024","09:22:42","OFFICE","Spoke with Sylvia it's a holiday for them so they are close must reschedule"
"138201","65244","AMELIA MANDERSCHEID","448 Clinton St Brooklyn 11231","RIVERA A.","04/01/2024","09:22:45","SERVICE","Service: PEST ELIM MAINT Conducting my services throughout apartment buildings  Treated oil Apartments and all four levels started from basement area  And basement area treated all base more perimeter throughout basement covered laundry room storage room and Boiler Room and Boiler Room apply three Liberty sticky boards  The water bug issue is starting to reduce it wasn't out of water bugs maybe one or two   An apartment one treated kitchen area and bathrooms   And all the rest of the apartments treated kitchen and bathroom also there were no signs of any activities or roaches mice or insects  Every customer signed Cod form took a picture of it and my inspection was completed right after"
"139633","66666","BEYOND DELI AND GROCERY","185 Norman Ave Brooklyn 11222","GREG","04/01/2024","09:23:00","OFFICE","spoke to Fuhad. He will speak o his staff to allow acess for our team"
"137973","65016","SUSAN SANTELLI","2115 78th St Brooklyn 11214","ANTHONY C.","04/01/2024","09:24:00","OFFICE","CLM FOR SUSAN RE RECENT SERVICE ON 3/23"
"110981","9357","BUTTERCUP BAKESHOP","973 2ND AVE NEW YORK 10022","PELLICER A","04/01/2024","09:26:11","SERVICE","Service: PEST ELIM MAINT Treated common areas checked monitors. Found two dead mice in ketchall and one baby rat and another catch all basement. Must clean up baking goods on the floor and back kitchen"
"121670","47846","MIDDLE VILLAGE ADULT CENTER","6910 75th St Middle Village 11379","ROSE","04/01/2024","09:27:00","OFFICE","SENT EMAIL TO ZALLEVY22 AND TO MIDDLEVILLAGE REQUESTING TAX EXEMPT CERTIFICATE WAITING.  CALLED 718-894-3441 NUMBER BUSY WILL TRY AGAIN"
"135740","62790","THIRD AVE DELI & GRILL","362 3rd Ave New York 10016","RIVERS","04/01/2024","09:28:26","911 EMER","Wants service next week Tuesday instead"
"139814","66845","ARTHUR GLASSFORD","146-35 221st Springfield Gardens 11413","ANTHONY C.","04/01/2024","09:29:00","OFFICE","SPOKE WITH ARTHUR IF HE NEEDS US BACK RE RECENT 3/23 MICE SERVICE HE WILL LET US KNOW"
"139633","66666","BEYOND DELI AND GROCERY","185 Norman Ave Brooklyn 11222","GREG","04/01/2024","09:29:00","OFFICE","Hi Fuhad, It was nice chatting with you. Please let your staff know that we will be servicingÂ this Tuesday into Wednesday morning"
"122998","49162","DI FARA RESTAURANT","1424 AVENUE J BROOKLYN 11230","PRICE J.","04/01/2024","09:30:36","SERVICE","Service: PEST ELIM MAINT General pest control service inspect all common areas check rodent control device found 2 mice caught inside ketchalls next to mixer behind pipes underneath sink dust all voids closed a few more small hole inside walk in box area and underneath sink rebaited rtus glue boards monitor device spray baseboard throughout kitchen sink area food prep area front entrance dining area countertops ovens refrigerator gel cracks and crevices took pictures believe mice entry front door took pictures gate don’t go all the way down"
"133382","60439","Little Kirin","81 Saint Marks Pl New York 10003","JOHNI","04/01/2024","09:31:00","OFFICE","as per rep, downgrade to 1 x per month - notified A/R"
"138315","65358","BREEZE","595 Manhattan Ave Brooklyn 11222","LUIS G","04/01/2024","09:32:00","OFFICE","LOCK CODE NOT WORK DOOR LOCK SOUND LIKE IT OPEN BUT DOESNT UNLOCK"
"132150","59216","DA GIORGIO RESTAURANT","77 Quaker Ridge Rd New Rochelle 10804","MOCK CHINO","04/01/2024","09:32:44","SERVICE","Service: PEST ELIM MAINT Service trap ketchall and was clean. Replace liberty glue board in basement, kitchen sink. Gel advion for roaches in kitchen sink. Spot treatment Suspend in baseboard, basement, kitchen, dining room, bar, behind counter, bathrooms, room next to kitchen going down to basement, storage, prep, office. Droppings in basement, kitchen by bakers pride oven. See photo. Update log sheet (Doh) IPM, RNR."
"115019","40225","TACIS BEYTE RESTAURANT","1955 Coney Island Ave Brooklyn 11223","GHEIDA J.","04/01/2024","09:33:01","SERVICE","Service: PEST ELIM MAINT General roach and rodent service sprayed perimeter drains bathrooms kitchen and prep areas basement perimeter checked equipment removed three dead mice from katchals upstairs basement was good no activity."
"133999","61056","Janie's Life Changing Baked Goods","212 W 80th St New York 10024","ANTHONY C.","04/01/2024","09:34:00","OFFICE","TOUCHED BASE WITH ALI RE DOOR SWEEP ALL GOOD NOW  AS PER ALI"
"139445","66478","ANIMO","1004 2nd Ave New York 10022","LOPEZ A.","04/01/2024","09:34:58","OFFICE","The location is trying to open in 2 weeks."
"138315","65358","BREEZE","595 Manhattan Ave Brooklyn 11222","MELENDEZ J","04/01/2024","09:36:22","911 EMER","Was not able to service, problem with lock, spoke to Louis, he's taking care of situation."
"139968","66998","Ann","2339  80street Brooklyn 11204","CAPPA T.","04/01/2024","09:38:54","ALERT","NOBODY HOME UPON ARRIVAL HAVE TO RE SCHEDULE"
"114265","39471","PRIVATE HOME 76 79TH ST","76 79th St Brooklyn 11209","ANTHONY C.","04/01/2024","09:39:00","OFFICE","TOUCHED BASE VIA TEXT RE RECENT ANTS SERVICE, SCHEDULED FOLLOW UP FOR TOMORROW"
"136148","63193","The Leopard at Des Artiste","1 W 67th St New York 10023","ROSARIO O.","04/01/2024","09:39:49","SERVICE","Service: PEST ELIM MAINT Serviced all rodent control monitoring equipment throughout areas. Inspected underneath the radiator for rodents. No trapped mice or rodent activity sighted during service. Refreshed glue traps as needed. Performed a preventative roach gel bait treatment throughout the coffee station, the kitchen and the bar area. No pest activity sighted at this time."
"129340","56435","STEVE MADDEN","200 Tanger Mall Dr Ste 1011 Riverhead 11901","MALDONADO","04/01/2024","09:40:26","SERVICE","Service: PEST ELIM MAINT Tech spoke with store manager Jonna during service.  Sprayed common areas including, display room, all isles, storage area, bathroom, hallway.  Replaced glue boards.   Checked monitoring devices, no activity at this time.   Location is very well kept, no issues to report.  Updated DOH log, picture taken."
"132441","59506","Ramen Danbo","48 Carmine St New York 10014","LORA R.","04/01/2024","09:41:25","SERVICE","Service: PEST ELIM MAINT Service Treated:  Dinning Area,Behind the Counter,Bathroom, Kitchen Area, Prep Area, Dishwasher Area,Garbage Area,Basement Area, Storage Area,Locker Room  Checked all Traps no activity found   Sprayed all common areas, Drains   Place a couple of Glueboards Down   Performed Ipm, RnR"
"139602","66635","CHELSEA PANTRY CAFE","405 W 23rd St New York 10011","CAROLINE","04/01/2024","09:42:00","OFFICE","COD ACCOUNT, PLEASE CALL 646-319-3464 TO MAKE SURE YOU SPEAK TO THE GM TO INFORM YOU WHERE THE COD WILL BE PER VISIT BEING THAT LOCATION WILL BE CLOSED UPON ARRIVAL, KEY ACCOUNT CUSTOMER, KEY FOR THE FRONT DOOR, NO ALARM CODE"
"139602","66635","CHELSEA PANTRY CAFE","405 W 23rd St New York 10011","CAROLINE","04/01/2024","09:42:00","OFFICE","FROM LIBERTY PEST CONTROL Inbox  caroline watson Mar 29, 2024, 1:09â€¯PM (3 days ago) Ignacio can you provide your cell phone number? So that i can give it to the regular technician so you and him can coordinate COD pick up upon services.  ignacio@chelseapantrycafe.com Mar 29, 2024, 4:21â€¯PM (3 days ago) to me  my cell number its 646)3193464 "
"121163","47339","Amelia's Bistro","187 Warren St Jersey City 07302","GHANIM MO","04/01/2024","09:42:17","SERVICE","Service: PEST ELIM MAINT Checked in with Stacey serviced and inspected all areas sprayed all necessary areas gel cracks and crevices checked and reset ketchalls no activity in ketchalls serviced tinkats replenished monitoring boards treated main floor bar and basmemt preparation kitchen heavy for german roaches treated all sinks and drains updated doh log"
"119781","45962","JACK ISRAEL","2202 Ocean Pkwy Brooklyn 11223","ANTHONY C.","04/01/2024","09:43:00","OFFICE","CLM FOR JACK RE RECENT ANT SERVICE"
"122011","48182","SAINT GEORGE ACADEMY","215 E 6TH ST NEW YORK 10003","ROSE","04/01/2024","09:45:00","OFFICE","SENT EMAIL TO STASIW@SGA. REQUESTING A TAX EXEMPT CERTIFICATE . WAITING FOR REPLY"
"131529","58596","One Sixty Madison","160 Madison Ave New York 10016","RIVERS","04/01/2024","09:45:01","SERVICE","Service: PEST ELIM MAINT Sprayed all common the basement boiler room,laundry room, lunchroom,bike room compactor room rooftop, & Checked all rodent devices & rebaited them  in the rooftop & loading dock areas for regular general service       No apts. rebiated all LP boxes in the terrace & garage areas"
"136841","63885","EMILIANO'S MARKET","5626 Mosholu Ave Bronx 10471","NICOLE.P","04/01/2024","09:51:00","OFFICE","CUSTOMER CALLED TO CANCEL - IT SOUNDED LIKE HE WAS OFFERED $45 SERVICE FROM ANOTHER COMPANY. I REMOVED THE CC FROM AUTO AND SENT TO CANCELLATIONS"
"129776","56859","MURPHY'S","986 2nd Ave New York 10022","PELLICER A","04/01/2024","09:51:42","SERVICE","Service: PEST ELIM MAINT Treated common areas and checked monitors all clean.  Spot sprayed under first bar by dishwasher with aerosol for roaches.  Spot sprayed up sty bar area with aerosol for flies.  Second floor party room in need of a fogging"
"126786","53906","ESQUIRE MGMNT CORP.","29 Perry St New York 10014","MORELL","04/01/2024","09:51:59","SERVICE","Service: PEST ELIM MAINT Conducted general service in all apartments listed on service sheet. Discovered rodent void in apartment 1R kitchen area behind stove (see photo). Applied tracking dust to rodent void and stuffed with copper mesh. Also applied tracking dust to basement ceiling. Discovered 2 dead mice in Ketchall station in apartment 3R. No voids discovered. Applied spot treatment to perimeter of all basement areas. Replaced glue boards in all needed areas. Inspection completed"
"136052","63097","PADEL HAUS","307 Kent Ave Brooklyn 11249","MELENDEZ J","04/01/2024","09:52:36","SERVICE","Service: PEST ELIM MAINT IPM,ALL GOOD."
"116392","41595","MOISE SAFRA CENTER","130 E 82nd St New York 10028","CORA JOSE","04/01/2024","09:53:03","SERVICE","Service: PEST ELIM MAINT Inspected and treated 12th floor, mechanical room. 10th floor kitchen. Nine floor kitchen. Lobby area trash,  room. Subbasement, mechanical room. Sprayed b and g transport,Tekko. Checked all bait stations. Checked ketchall. Checked t- Rex. Checked rtu’s. Checked Lps. Spray all drains for flies and the kitchen area. Sign doh."
"116319","41522","FREDDIE'S GOURMET","3830 Richmond Ave Staten Island 10312","GREG","04/01/2024","09:55:00","OFFICE","Hi Danny,  Hope all is well with you. Our tech is concerned about the rodent entry points, voids and ongoing rodent concerns. He recommends a rodent proofing evaluation. Please see his notes below. This would be a no charge inspection.  Our rodent proofing specialist would provide this during the day and will share his findings and recommendations with you.  After completion of the inspection we would provide a cost associated with the recommended work. You can then have us provide the service or have your team do it , but at the least you'll have our recommendations at your fingertips. Please let me know if you'd like to proceed with this and I'll be glad to schedule"
"138880","65919","CAFE 424","424 W 54th St New York 10019","R. CARRION","04/01/2024","09:55:00","OFFICE","Location is closed on Mondays and Tuesdays. Service Wed-Fri. I rescheduled March."
"109708","8352","105 EAST 97TH ST HDFC","105 E 97th St New York 10029","CAROLINE","04/01/2024","09:56:00","OFFICE","CALLED FOR ACH OR CC AND NO ANSWER EMAILED CUSTOMER AGAIN"
"139018","66057","Hana House","345 Adams St Brooklyn 11201","IADAROLA","04/01/2024","09:56:20","SERVICE","Service: PEST ELIM MAINT General service   Perimeter baseboard treatment throughout entire establishment 1st & 2nd floor   Fan sprayed underneath kitchen appliances / pipes & drains   Installed monitors   Gel crack & crevice / wooden fixtures   Reset all ketchall devices no catches noted   IPM   I could not locate doh log so I put up a new one and updated it"
"135077","62133","MEALZ","245 E 14th St New York 10003","GREG","04/01/2024","09:57:00","OFFICE","Hi Team,  Hope all is well with you. Our tech is concerned about the rodent entry points, voids and ongoing rodent concerns. He recommends a rodent proofing evaluation. Please see his notes below. This would be a no charge inspection.  Our rodent proofing specialist would provide this during the day and will share his findings and recommendations with you.  After completion of the inspection we would provide a cost associated with the recommended work. You can then have us provide the service or have your team do it , but at the least you'll have our recommendations at your fingertips. Please let me know if you'd like to proceed with this and I'll be glad to schedule"
"139336","66372","CHOCOLATE HOUSE","2588 Steinway St Astoria 11103","KNEE JR.","04/01/2024","09:58:25","SERVICE","Service: GENERAL SERVICE General service rodents and roaches I sprayed around whole interior bathroom dining area kitchen basement there is no activity on the monitoring devices or traps place looks good I signed doh I’ll continue to monitor used aerosol where needed"
"112552","10340","BLUE MOON","26 NORTH PARK AVE ROCKVILLE CENTER 11570","RICHARDS J","04/01/2024","09:58:58","SERVICE","Service: PEST ELIM MAINT Inspected areas .Treated common areas and gel cc, checked equipment. Flushed out existing pest with aerosol and knock down. Perimeter treatment applied throughout in all areas and spaces , hp of monitors placed .signed doh"
"131271","58339","Dutch Baby Bakery","813 W 187th St New York 10040","VALERA F.","04/01/2024","09:59:37","SERVICE","Service: PEST ELIM MAINT Inspected 4 trap ketchalls, each were inactive.   Spot treatment applied to baseboards, kitchens 1 and 2, bathrooms, behind service counter, behind and under all kitchen appliances.   Updated doh log (see photo)   IPM, RNR."
"138703","65743","SEASIDE NYC","31-62 Steinway St Astoria 11103","GREG","04/01/2024","10:00:00","OFFICE","Hi Brian,  Hope all is well with you. Our tech is concerned about the rodent entry points, voids and ongoing rodent concerns. He recommends a rodent proofing evaluation. Please see his notes below. This would be a no charge inspection.  Our rodent proofing specialist would provide this during the day and will share his findings and recommendations with you.  After completion of the inspection we would provide a cost associated with the recommended work. You can then have us provide the service or have your team do it , but at the least you'll have our recommendations at your fingertips. Please let me know if you'd like to proceed with this and I'll be glad to schedule"
"109721","8255","7TH AVE DONUTS SHOP","324 7TH AVE BROOKLYN 11215","CAROLINE","04/01/2024","10:01:00","OFFICE","SPOKE TO TEDDY HE STATED GEORGIA OR TOMMY MAKES DECISIONS FOR PAYMENTS"
"138703","65743","SEASIDE NYC","31-62 Steinway St Astoria 11103","ANTHONY C.","04/01/2024","10:01:00","OFFICE","CLM FOR BRIAN WELCOMING HIM TO THE TEAM"
"136841","63885","EMILIANO'S MARKET","5626 Mosholu Ave Bronx 10471","STEPHEN","04/01/2024","10:02:00","SAVED","saved account . emiliano called to cancel he said he had another company for $45. i lowered the price to 65 plus tax he agreed"
"139363","66398","Traditas pizza","1165 Broadway New York 10001","GREG","04/01/2024","10:03:00","OFFICE","Hi Leonard,  Hope all is well with you. Our tech is concerned about the rodent entry points, voids and ongoing rodent concerns. He recommends a rodent proofing evaluation. Please see his notes below. This would be a no charge inspection.  Our rodent proofing specialist would provide this during the day and will share his findings and recommendations with you.  After completion of the inspection we would provide a cost associated with the recommended work. You can then have us provide the service or have your team do it , but at the least you'll have our recommendations at your fingertips. Please let me know if you'd like to proceed with this and I'll be glad to schedule"
"115599","40804","SPUNTO","65 Carmine St New York 10014","LORA R.","04/01/2024","10:05:10","SERVICE","Service: PEST ELIM MAINT Service Treated:  Bar Area,Lounge/Dinning Area,Brick Oven,Kitchen Area, Prep Area, Dishwasher Area,Basement Area, Storage Area,Locker Area Garbage Area  Checked all Traps no activity found   Sprayed all common areas, Drains   Place a couple of Glueboards Down   Performed Ipm, RnR"
"131090","58159","PICK A BAGEL","1101 Lexington Ave New York 10075","GREG","04/01/2024","10:06:00","OFFICE","Hi Muhammad,  Hope all is well with you. Our tech is concerned about the rodent entry points, voids and ongoing rodent concerns. He recommends a rodent proofing evaluation. Please see his notes below. This would be a no charge inspection.  Our rodent proofing specialist would provide this during the day and will share his findings and recommendations with you.  After completion of the inspection we would provide a cost associated with the recommended work. You can then have us provide the service or have your team do it , but at the least you'll have our recommendations at your fingertips. Please let me know if you'd like to proceed with this and I'll be glad to schedule"
"139348","66384","SUSHI NABI","362 Cedar Ln Teaneck 07666","ANTHONY C.","04/01/2024","10:07:00","OFFICE","WELCOMED KYUNG AND LURI TO TEAM LIBERTY  VIA TEXT"
"139836","66867","PROVA ITALIAN AMERICAN DELI","94 Moonachie Ave Moonachie 07074","WILLIAMS C","04/01/2024","10:07:18","SERVICE","Service: NEW ACCT SVCE Inspected and treated the kitchen storage room bathrooms dining and all common areas dusted holes and voids sprayed and common areas perform a roach treatment in the kitchen set several traps and monitors installed new Doh form."
"116752","41953","MONTESSORI SCHOOLS","75 Sullivan St New York 10012","REPS S.","04/01/2024","10:07:31","SERVICE","Service: RODENT PROOFING Sealed voids at teachers lounge. See photos. Called rob. He gave me access. Fridge at teachers lounge is bolted in, can’t move it. Fridge has to be taken out completely in order to be able to seal gap."
"118538","43727","SAN PEDRO INN","320 VAN BRUNT ST BROOKLYN 11231","RIVERA A.","04/01/2024","10:07:38","SERVICE","Service: PEST ELIM MAINT Conducting my services bar restaurant  Treated all common areas dining room sitting area Lounge area  All bathrooms  Kitchen area Underneath stoves on the refrigerators underneath sinks or drains   Treated bar area all around the perimeter  Basement area treat it all storage rooms office and grease trap  Check oil stations did not discover any signs of any mice or rodent activity  Sign the Doh log sheet and my inspection was completed"
"138880","65919","CAFE 424","424 W 54th St New York 10019","JOHNI","04/01/2024","10:08:00","OFFICE","CHANGED SERVICE SETUP TO WED-FRI"
"138851","65890","ALICE'S WEST INDIAN","171 Main St Orange 07050","SUTTON J.","04/01/2024","10:08:56","SERVICE","Service: PEST ELIM MAINT Inspected the interior and exterior and found activity in kitchen mice, I sprayed with Gentrol IGR in all areas the dining area behind the counter the bathrooms and kitchen I checked and serviced 3 4 tincans found activity in 2 tincans and glueboard total of 6 mice removed replaced with dated glueboards used ZP tracking powder in all cracks crevices and voids located doh Collected 65.00 cash took picture"
"139791","66822","Tristan Martin LLC","4147 48th St Sunnyside 11104","ANTHONY C.","04/01/2024","10:10:00","OFFICE","SPOKE WITH TRISTAN WELCOMED HIM TO TEAM LIBERTY"
"116802","42003","GREENTREE PHARMACY","291 7th Ave Brooklyn 11215","NICOLE.P","04/01/2024","10:10:00","OFFICE","NO PAYMENT WAS MADE IN THE MONTH OF FEB. REVERSING TIFFANYS PAYMENT BC THE PAYMENT IS INCORRECT. THERE WAS A PAYMENT ON 10/1/2023 AND 12/30/2023 AND 3/29/2024"
"115343","40549","GOLDEN KRUST","872 Utica Ave Brooklyn 11203","GREG","04/01/2024","10:11:00","OFFICE","Hi Loisa,  Hope all is well with you. Happy New Year!!! Our tech is recommending a comprehensive fly service and a space fog for a quick knockdown of the flies. Please see his notes below. For him to space fog we need your staff to prep. Please make sure all food is put away.AC is shut along with vents, smoke alarm and fire alarm are off and all the pilots are shut on the ovens and anywhere else.  No charge for this follow up fly service. Please let me know if you'd like us to proceed with this service and I'll be glad to schedule."
"139804","66835","PONCE FUNERAL HOME","2715 Atlantic Ave Brooklyn 11207","ANTHONY C.","04/01/2024","10:12:00","OFFICE","SPOKE WITH EVETTE WELCOMED THE ACCOUNT TO TEAM LIBERTY"
"135384","62439","18 CHATSWORTH AVE LLC","18 Chatsworth Ave Larchmont 10538","BLACK R.","04/01/2024","10:13:59","SERVICE","Service: PEST ELIM MAINT Service all areas provided by management spray kitchen behind stove fridge under tables sink counter drains dishwasher under cold bar put gel monitors basement caught two mice one in tin catch and one on glue boards put ZP powder in holes refill bait stations and triangles boxes with bait boiler area electrical area sprinkler storage area replaced glue boards and add glue boards IPM R&R treatment gel for roaches"
"139966","66996","FIONAS HOUSE","559 86th St Brooklyn 11209","CAPPA T.","04/01/2024","10:14:46","SERVICE","Service: NEW ACCT SVCE Set 5 rat snaps basement  Installed 2 ketchalls ground level 3 Lp installed basement  Monitors installed and set  Dusted voids in brick foundation of basement  Perimeter treatment baseboards throughout establishment  Updated doh log Rat droppings found in basement old droppings here  American roaches basement areas"
"139840","66871","JERRY'S PIZZA & RESTAURANT","698 Nj-440 Jersey City 07304","ANTHONY C.","04/01/2024","10:15:00","OFFICE","SPOKE WITH JERRY WELCOMED ACCOUNT TO TEAM LIBERTY"
"138189","65232","1012 KITCHEN","1012 E 15th St Brooklyn 11230","PRICE J.","04/01/2024","10:15:14","SERVICE","Service: PEST ELIM MAINT General pest control service inspect all common areas check rodent control device no light in basement fan spray baseboard throughout underneath sink dust American roaches gel cracks and crevices niban glue boards monitor device spray baseboard throughout upstairs underneath stove ove bathroom sink front entrance area gel cracks and crevices change glue boards tincats"
"138965","66004","Sanctified Church Of god","404 Lefferts Ave Brooklyn 11225","RIVERA M.","04/01/2024","10:15:27","SERVICE","Service: PEST ELIM MAINT Spot treatment of the entire basement.  Service was provided to apartment 2R. Apartments 3R ,2F, and 2R were not home . I placed glue boards in apartment 2R. I treated for ants in the men's bathroom on the first floor.  I checked and rebaited all rtu boxes.  The was activity in one rtu box.  IPM.   The only part I was not able to provide service to was the church because staff member did not have the keys . I was asked if I could wait for 30 minutes . I called the office and was told to move on.."
"133759","60816","VERANA","530 Livingston St Norwood 07648","FORD J.","04/01/2024","10:15:33","SERVICE","Service: ANTS Inspected and treated the bar and coffee station for ants. There is activity all along the bar and in some drawers. I used 2 tubes of gel bait all around these areas. I also sprayed BandG transport along the baseboards and underneath the sinks and appliances. I cleaned out some food debris and setup glue boards to monitor the areas. I also treated the kitchen and exterior areas around the doors and windows and the perimeter of the restaurant. My next regular service visit is in one week."
"139602","66635","CHELSEA PANTRY CAFE","405 W 23rd St New York 10011","KONYAH J.","04/01/2024","10:15:52","SERVICE","Service: KEY PICK UP Key picked up from Ignacio and tested. Key work properly and will be dropped at the office as soon as possible"
"126230","53353","LORIMER DELI AND GROCERY","593 Metropolitan Avenue Brooklyn 11221","ANTHONY C.","04/01/2024","10:17:00","OFFICE","SPOKE WITH WORKER WELCOMED THE ACCOUNT TO TEAM LIBERTY"
"139241","66278","GREYSTONE CONDOMINIUM","127 W 82nd St New York 10024","VIZCARANDO","04/01/2024","10:17:43","SERVICE","Service: MICE GENERAL SERVICE: IM SERVICING APARTMENT 2-C FOR MICE IT LOOKS LIKE THEY DID RODENT PROOFING  IN THE KITCHEN BEHIND THE STOVE BUT THE CHICKEN WIRE HAS IN VOID IN IT IT LOOKS LIKE THE SCREWS CAME LUSE SO I PUSHED THEM IN I THINK IT NEEDS FOAM AROUND THE EDGE. SO RIGHT NEXT TO IT I FOUND A VOID I DUST IT AND SEALED IT SEE PHOTOS I FOUND ANOTHER VOID IN THE DAUGHTERS ROOM BY THE PIPE I DUST IT AND SEALED IT SEE PHOTOS I FOUND TWO MORE VOIDS BEHIND THE BED I DUST THEM AND SEALED THEM SEE PHOTOS ALSO THE MESS IN THE BATHROOM AROUND THE PIPE CAME OUT SEE PHOTOS SHE DID NOT WANT ME TO PUT IT BACK SHE WANTS TO SHOW THE TECHS  I ALSO PUT DOWN GULE BOARDS FOR MONITORING IPM RNR"
