"Location Code","Location ID","Company","Address Line 1","Added By","Note Date","Note Time","Note Code","Note"
"116731","41932","GOOD THANKS","131 ORCHARD ST NEW YORK 10002","OLLIVIERRE","04/01/2024","23:24:10","SERVICE","Service: PEST ELIM MAINT Full Inspection of the kitchen, coffee station, dining, and basement.   No pest activity or sanitary issue was found on the first floor during service. No sanitary issues found in the basement.   Fan spray treatment throughout the kitchen, coffee station, dining area, and basement. Cracks and crevices gel treatment throughout the kitchen, coffee station, and basement.   Replaced all old monitors and glue boards throughout the basement and kitchen.  Checked and reset all katchalls.  Updated doh."
"139650","66682","LAS CRAZY PINAS RESTAURANT","510 Georges Rd North Brunswick 08902","IQBAL","04/01/2024","23:27:49","KEY ISSUE","I checked for this key on key ring not on here and the new keys I got today are not for this location cannot service no keys"
"135827","62876","WONTON GUY","1803 NJ 27 EDISON 08817","IQBAL","04/01/2024","23:29:00","OFFICE","It's Monday they are closed every Monday I cannot get a he lockbox outside because Gary you contact him before hand and he's not there it's closed he will not drive down to leave it out I been down this road before I tried once he told me come another day in past so this has to be either put on someone else or given to me Sunday night while I'm in the vicinity"
"115436","40642","SALAD BOX","44 Park Pl New York 10007","CARRASQUIL","04/01/2024","23:29:37","SERVICE","Service: PEST ELIM MAINT Serviced traps and devices in kitchen and basement and front  Installed monitors and glue boards throughout kitchen , basement and front  Crack and crevice treatment in kitchen , basement and front  Sprayed all necessary areas. Update Doh log"
"128742","55845","Chelsea Bagel","62 E 34th St New York 10016","BELTRAN","04/01/2024","23:37:42","SERVICE","Service: PEST ELIM MAINT Location seems clean for any roach and rodents in main entrance and counter.  Location seems clean in the main bagel oven prep area. However, I recommend to clean and sweep floor more deeply and more often. All that flour will attract rodents to the house   Location main counter I recommend to also clean and remove all the garbage that is underneath fridges  Muffins and dust starting to accumulate around kitchen and bagel store.  Location basement seems clean  Location basement have service with glue traps, flush out and service equipment   Main entrance, counter and bagel oven area have service with glue boards, flush out and service equipment"
"132261","59327","Chamoyz Snack Bar","276 George St New Brunswick 08901","IQBAL","04/01/2024","23:39:34","SERVICE","Service: PEST ELIM MAINT Spot treatment throughout establishment perimeter . Sign doh"
"134933","61989","P&T Knitwear","180 Orchard St New York 10002","OLLIVIERRE","04/01/2024","23:41:57","SERVICE","Service: PEST ELIM MAINT Full Inspection of the main floor cafe and offices.  Checked all traps and monitors.   No pest activity during service.  No sanitary issues found.   Cracks and crevices gel treatment throughout the first floor cafe area.   Replaced all monitors and glue boards throughout the establishment.  Spot treatment in the office.  Fan spray treatment throughout all common areas and hot spot.  Updated Doh."
"133203","60260","PRINCE TEA HOUSE","324 New Dorp Ln Staten Island 10306","GUITEREZ O","04/01/2024","23:54:46","SERVICE","Service: PEST ELIM MAINT Inspection reset kechalls monitors treated bathrooms treated basement treated counters treated dining room treated kitchen treated storage room"
"123226","49389","Tre Sorrelle","61 Reade St New York 10007","CARRASQUIL","04/01/2024","23:57:00","KEY ISSUE","O do t have the keys for this account"
"128254","55358","Split Eights","40 Exchange Pl New York 10005","CARRASQUIL","04/01/2024","23:59:00","KEY ISSUE","I don't have keys for this account"
"132016","59083","EL PUEBLO QUERIDO MEXICAN","42 Main St South River 08882","IQBAL","04/02/2024","00:01:40","SERVICE","Service: PEST ELIM MAINT Roach treatment. Eco PCU knock down several German roach colonies in kitchen crack and crevices. They originate specifically in the cracks and crevice of broken tile on the right side of kitchen there is tile missing and a gap they come from, back of kitchen is these freezers they come from underneath there can’t reach not possible unless it’s moved, under kitchen sink the pvc pipes have huge holes that if rats were present they’d originate from this void. German roaches extremely present throughout the kitchen not anywhere else it’s isolated to one room for now ! They need to upgrade to 2x a month or get an actisol treatment. Once a month I can’t knock down a moderate to semi heavy infestation it’s just not punctual.   Sign doh"
"117144","42345","LENWICH","469 COLUMBUS AVE NEW YORK 10024","CLAUDIO R.","04/02/2024","00:02:06","SERVICE","Service: PEST ELIM MAINT After inspecting location I’ve concluded that location is activity free and furthermore free of any sanitation issues .premises is always spotless clean   Treated establishment by fan spraying the entire  perimeter. Location I…treated the bathroom  the baseboards the basement underneath the sink underneath the countertops behind appliances   Updated DOH. LOG.    PHOTO. ENCLOSED"
"134334","61391","Huge Thai","157 Court St Brooklyn 11201","HARRIS","04/02/2024","00:02:11","SERVICE","Service: PEST ELIM MAINT General service Upon inspection of interior and exterior areas, showing of mice activity and droppings in kitchen area along back wall under storage area. Please note. : there are no visuals.katchal traps, nor RTUs in the premises. Recommend.Katchal/RTUs be placed throughout kitchen area. Signed DOH sheet.   Sanitation issues : None."
"132812","59872","Sunrise Market Brooklyn","934 3rd Ave Brooklyn 11232","BLAKAJ A.","04/02/2024","00:02:19","SERVICE","Service: PEST ELIM MAINT Upon inspecting establishment I observed no activity or signs of act throughout the location and location is well maintained.  Placed traps and monitors throughout establishment including prep area, meat market, fish market, deli and register areas.   Gel treatment crack and crevices throughout establishment including prep area, fish market, meat market, deli, by fridges, bathrooms and register areas.  Checked and serviced  all traps and equipment.   Inspected and serviced  907 fly light monitor.   Treated perimeter of establishment including register areas, bathrooms, fridges, meat market, fish market, deli and prep area  Signed doh but can’t upload on pest pac"
"134891","61947","Ventrop","369 W 34th St New York 10001","RITTER P.","04/02/2024","00:02:34","SERVICE","Service: PEST ELIM MAINT 1 dead mouse in ketchall in break room.Inspected and serviced all areas,checked snaps traps,RTUs,& ketchall.Clean.Applied gel in cracks and crevices.Sprayed gentrol in every office room,outside area,Meeting room,break room,bathrooms,& cleaning room. & signed doh sheet."
"117043","42244","PASTAGRAM","241 Pearl St New York 10038","CARRASQUIL","04/02/2024","00:02:44","SERVICE","Service: PEST ELIM MAINT Serviced traps and devices in kitchen.  Installed monitors and glue boards throughout kitchen.  Crack and crevice treatment in kitchen Please has no pest issues.  Sprayed all necessary areas. Update Doh log"
"128742","55845","Chelsea Bagel","62 E 34th St New York 10016","BELTRAN","04/02/2024","00:05:24","911 EMER","Location seems clean for any roach and rodents in main entrance and counter.  Location seems clean in the main bagel oven prep area. However, I recommend to clean and sweep floor more deeply and more often. All that flour will attract rodents to the house   Location main counter I recommend to also clean and remove all the garbage that is underneath fridges  Muffins and dust starting to accumulate around kitchen and bagel store.  Location basement seems clean  Location basement have service with glue traps, flush out and service equipment   Main entrance, counter and bagel oven area have service with glue boards, flush out and service equipment"
"115413","40619","Ribalta","48 E 12th St New York 10003","KHAMRAJ K.","04/02/2024","00:06:03","911 EMER","No activity was found during the visit in establishment.   Clutter upstairs by locker room. As shown in pictures.  Establishment is being kept clean.   Serviced equipment in the kitchen area pizza oven area bar area dining area dishwashing area bathroom area. Replaced all glue board monitors and all bait stations.   Serviced equipment on second floor locker room area storage room area and replenished all glue board monitors."
"126423","53546","PICCOLA CUCINA UPTOWN","106 E 60TH ST NEW YORK 10022","OLLIVIERRE","04/02/2024","00:10:14","SERVICE","Service: PEST ELIM MAINT Did a full inspection all areas of the main fl 2nd fl courtyard and front dining.   No activity found this visit. No sanitary issue this visit. No signs of rodent or any other activity during service.   Perimeter treatment around the basement kitchen and drains.  Cracks and crevices treatment throughout entire establishment.  Replaced glue boards and monitors throughout the basement, 1st, and 2nd floor.  Checked and reset all katchalls.  Reset snaps in the basement ceiling.  Updated doh."
"134178","61235","Preveti Pizza 34th St","344 E 34th St New York 10016","MORA H.","04/02/2024","00:11:14","SERVICE","Service: PEST ELIM MAINT Upon arrival I began in the second floor sprayed the kitchen, , Pizza station, restroom and dining area  Inspected all tincats, placed monitors  Sprayed for flies Gel bait in cracks and crevices  Placed rat snaps in the kitchen"
"132016","59083","EL PUEBLO QUERIDO MEXICAN","42 Main St South River 08882","IQBAL","04/02/2024","00:11:27","911 EMER","They need to upgrade to 2x a month or get an actisol treatment. This is a moderate to semi heavy German roach infestation I've let it be known numerous times. I understand from notes that they did not approve the 2x a month that is fine. I'm just letting it be known as the technician that get the feedback there is nothing I can do in one sitting for a 30 minute service to fix them permanently they need more then one service every 30 days"
"138606","65649","Spicy Moon West Village","68 W 3rd St New York 10012","BELTRAN","04/02/2024","00:16:41","SERVICE","Service: PEST ELIM MAINT Location has found rats active in the back yard.  Location only have 1 bait station, it’s not enough for this yard plus rats are coming from everywhere.  I recommend to have more equipment in this location.  2 more bait stations for the back yard at least.  Location back yard have service with glue traps, flush out and service equipment   Location main dinning room area and bar seems clean for roach and rodents,  Location main dinning room area and bar have service with glue traps, flush out and service the 2 RTUS AT THE BAR  Location basement has found no activity for any roach and rodents.   Location basement have service with glue traps, flush out and service equipment. However, don’t forget that still void points that still not covered yet!"
"113934","11843","PATRIZIAS OF MANHATTAN","462 2ND AVE NEW YORK 10016","KHAMRAJ K.","04/02/2024","00:21:48","SERVICE","Service: PEST ELIM MAINT No activity was found during the visit.  But there was a dead mouse found in a ketch all in the Boiler Room in the basement. As shown in the picture.  Also, standing water in the basement by the freeze as shown in the picture.  Serviced all equipment in the establishment of the upstairs kitchen area, dining area restroom area, and oven area.  And replenished all glue board monitors and bait stations.   Serviced all equipment in the basement stock room locker room and garbage room area. Replenished all glue board monitors and bait stations.   Prevention treatment was also done throughout the establishment of the upstairs kitchen area dining area restroom area and in the basement stock room and locker room and boiler room area."
"112389","10231","COME PRIMA","903 MADISON AVE NEW YORK 10021","CHOW E.","04/02/2024","00:26:42","SERVICE","Service: BLITZ No activity observed at the time of service   Crack and crevice treatment using B&G sprayer and gel bait  Spot treatment using residual and aerosols   Dusted areas for rodents Checked and reset Ketchalls   Updated DOH log"
"138381","65424","CHAMPION PIZZA SOHO","17 Cleveland Pl New York 10012","CARRASQUIL","04/02/2024","00:30:54","SERVICE","Service: PEST ELIM MAINT Service traps and devices in basement, pizza area. Checked all LP were fine. Checked Rat snaps got rid of two rats and reset them. Void treatment throughout basement Crack and crevice treatment through our basement and pizza area.  Checked and addednew glue boards throughout pizzeria and basement.  Sprayed all necessary areas . Updated dog log"
"127904","55011","AMBROSINOS PIZZERIA","3161 AMBOY RD STATEN ISLAND 10306","GUITEREZ O","04/02/2024","00:38:10","SERVICE","Service: PEST ELIM MAINT Inspection mice droppings around refrigerator treated lps treated rtus treated voids reset kechalls treated dining room treated counters treated bathrooms treated kitchen. Needs 5 new kechalls"
"135110","62166","BAGEL FACTORY CAFE","2 Cliffwood Ave W Matawan 07747","IQBAL","04/02/2024","00:42:31","SERVICE","Service: PEST ELIM MAINT Render full general service throughout the establishment and drains. Sign doh"
"124678","51828","ROCKBOTTOM MORRIS PATIO & GRILL","4 JOHN ST MORRISTOWN 07960","GALIONE J.","04/02/2024","00:46:23","KEY ISSUE","Unable to gain access locks were changed"
"132811","59871","Japan Village","934 3rd Avenue Brooklyn 11232","BLAKAJ A.","04/02/2024","00:46:25","SERVICE","Service: PEST ELIM MAINT Upon inspecting establishment I observed no activity or signs of activity throughout the establishment. Food particles found all under the appliances throughout the main level. Highly recommend that the location take extra time and clean up under the appliances. Also pieces of food found in most of the drains in the basement sinks with the warmer weather coming highly recommend that they clean the drains every night esprit being a big location.   Placed traps and monitors throughout the establishment including basement, bakery, sushi bars, and storage both bars.   Gel treatment crack and crevices throughout the building, storage, bakery, bars, kitchen and sushi bars.   Checked and serviced all traps and equipment  Inspected and serviced  907 fly light monitor.   Treated all drains and sinks throughout the basement.   Treated perimeter of establishment including basement, storage, sushi bars, kitchen, bars, bakery and dinning.   Signed doh but couldn’t post on pest pac"
"136671","63715","SERAFINA 28","241 Madison Ave New York 10016","MORA H.","04/02/2024","00:47:26","SERVICE","Service: PEST ELIM MAINT Heavy fan spray the kitchen, lockers area , replaced monitors  Gel bait in cracks and crevices, inspected all equipments Replaced fly board  Sprayed for flies in the bar and pizza station"
"138606","65649","Spicy Moon West Village","68 W 3rd St New York 10012","BELTRAN","04/02/2024","00:51:09","911 EMER","Location has found rats active in the back yard.  Location only have 1 bait station, it’s not enough for this yard plus rats are coming from everywhere.  I recommend to have more equipment in this location.  2 more bait stations for the back yard at least.  Location back yard have service with glue traps, flush out and service equipment   Location main dinning room area and bar seems clean for roach and rodents,  Location main dinning room area and bar have service with glue traps, flush out and service the 2 RTUS AT THE BAR  Location basement has found no activity for any roach and rodents.   Location basement have service with glue traps, flush out and service equipment. However, don’t forget that still void points that still not covered yet!"
"123442","49605","SERAFINA TRIBECA","95 W Broadway New York 10007","CAPALDI J.","04/02/2024","00:51:36","SERVICE","Service: PEST ELIM MAINT Forgot to press start when arrived. General service sprayed gel. Drain fly treatment bar. Waterbug treatment basement  Sprayed all 3 floors  bathrooms  closets storage room"
"110203","9170","IHOP","254-02 ROCKAWAY BLVD ROSEDALE 11422","ROSARIO A.","04/02/2024","00:57:56","SERVICE","Service: PEST ELIM MAINT Ipm did not have doh log I’ll sign next visit. Checked all areas and equipment did a general service. Set mouse and rat snap trap."
"134232","61289","WILD GINGER","112 SMITH STREET BROOKLYN 11201","HARRIS","04/02/2024","00:59:00","KEY ISSUE","Need key to Electric gate."
"127964","55071","FARIDA II","32 Cedar St New York 10005","CAPALDI J.","04/02/2024","01:00:15","SERVICE","Service: PEST ELIM MAINT General services  Roach service  Crack and crevice"
"128073","55177","Modern Bread & Bagel","472 Columbus Ave New York 10024","CLAUDIO R.","04/02/2024","01:01:16","SERVICE","Service: PEST ELIM MAINT After inspecting the premises of location I’ve determined that at this moment I didn’t find anything to indicate active activity nor is there anything to substantiate any sanitation issues   Treated all areas by fan spraying full 360 around the perimeter of location including the bathroom the basement the baseboards underneath the sink underneath the countertops   Updated DOH. LOG. PHOTO. ENCLOSED"
"137195","64238","HALAL MUNCHIES","82 Livingston St Brooklyn 11201","HARRIS","04/02/2024","01:05:05","SERVICE","Service: PEST ELIM MAINT General service Upon inspection of interior and exterior, basement area, dirty floors, greasy and boxes everywhere on the floor and back area. Please review service ticket video.."
"126888","54008","FRESCO PIZZERIA & ITALIAN EATERY","475 Spotswood Englishtown Rd Monroe Township 08831","IQBAL","04/02/2024","01:11:41","SERVICE","Service: PEST ELIM MAINT Render full general service throughout establishment perimeter. Sign doh"
"132772","59832","MAH ZE DAHR","28 Greenwich Ave New York 10011","OLLIVIERRE","04/02/2024","01:16:51","SERVICE","Service: BLITZ Inspected all areas of the first floor, staircase and basement. Checked all traps and monitors.   No pest activity found.  No sanitary issues found.   Checked and reset all katchalls.  Placed glue boards and monitors throughout the entire establishment.  Cracks and crevices gel treatment throughout the entire establishment.  Fan sprayed the entire establishment garbage room, basement kitchen, first floor counter and back area.   Updated doh."
"132751","59811","HONEST","811 Newark Ave Jersey City 07306","GALIONE J.","04/02/2024","01:17:03","SERVICE","Service: PEST ELIM MAINT I inspected and serviced the dining room area, the common area the storage room. The bathroom behind the counter and the kitchen there’s a lot of roach activity in the kitchen. They need fogging.done. No other activity to report I updated the DOH log."
"134383","61440","Table D'hote","44 E 92nd St New York 10128","RITTER P.","04/02/2024","01:34:03","SERVICE","Service: PEST ELIM MAINT Inspected and serviced all areas. Checked all ketchall,RTUs,rat traps & rats glue boards.No activity found inside. Checked all changed all glue boards.Applied gel in cracks and crevices.Sprayed gentrol in dining, bathroom, kitchen areas underneath kitchen sink, basement storage areas, boiler area,employees room,& signed doh"
"113934","11843","PATRIZIAS OF MANHATTAN","462 2ND AVE NEW YORK 10016","KHAMRAJ K.","04/02/2024","01:35:25","911 EMER","No activity was found during the visit.  But there was a dead mouse found in a ketch all in the Boiler Room in the basement. As shown in the picture.  Also, standing water in the basement by the freeze as shown in the picture.  Serviced all equipment in the establishment of the upstairs kitchen area, dining area restroom area, and oven area.  And replenished all glue board monitors and bait stations.   Serviced all equipment in the basement stock room locker room and garbage room area. Replenished all glue board monitors and bait stations.   Prevention treatment was also done throughout the establishment of the upstairs kitchen area dining area restroom area and in the basement stock room and locker room and boiler room area."
"138341","65384","Iris Cafe","125 Bridge Park Dr Brooklyn 11201","HARRIS","04/02/2024","01:35:59","SERVICE","Service: PEST ELIM MAINT General service Upon inspection of interior and exterior areas, bar area, show signs of mice droppings behind counter area between sink and small refrigerator. Checked all traps reset all traps. Signed DOH sheet. See photo."
"130408","57480","Thyme and Tonic","474 Columbus Ave New York 10024","CLAUDIO R.","04/02/2024","01:42:36","SERVICE","Service: PEST ELIM MAINT In the process of inspecting the premises I encountered a Huge Rat in the alcohol room he was right on top of me. It looked like it wanted to to jump on me or run at me comi  Treated location with Gentrol and ditrac   Updated DOH.  LOG.  PHOTO. ENCLOSED"
"133438","60495","Somerset Pizza & Restaurant","147 Pierce St Somerset 08873","IQBAL","04/02/2024","01:45:25","SERVICE","Service: PEST ELIM MAINT Render full general service throughout establishment perimeter. Sign doh"
"133649","60706","Ambrosinos","240 Arden Ave Staten Island 10302","GUITEREZ O","04/02/2024","01:45:38","SERVICE","Service: PEST ELIM MAINT Inspection treated tin cats flush out with eco treated bathrooms dining room treated bathroom kitchen treated counters"
"124474","51624","SERAFINA BROADWAY","210 W 55th St New York 10019","LITTLE T.","04/02/2024","01:52:02","SERVICE","Service: PEST ELIM MAINT Inspect and serviced location for inspect and rodent activity, German cockroaches found on glue board inside basement. Crack & crevice treatment performed in kitchen and basement. Fan sprayed kitchen and inspect & changed glue in tincats. Inspect and serviced bar, hallway, coffee station and basement  Updated doh log"
"118371","43560","FISH CHEEKS","55 BOND ST NEW YORK 10012","BELTRAN","04/02/2024","01:55:59","SERVICE","Service: PEST ELIM MAINT Location seems clean for mice, however, location staring to have German cockroach activity in the small kitchen and Basement   I recommend to sweep more deeply, wash floor and dry   Location second door to street still needs 2 door sweep for both doors.  Please see pictures provided   Location main kitchen, 2nd kitchen and dinning are have service with glue traps, flush out and service equipment   Location basement have service with glue traps, flush out and service equipment"
"128945","56048","IL POSTINO","133 E 61st St New York 10065","MORA H.","04/02/2024","01:57:20","SERVICE","Service: PEST ELIM MAINT Did gel bait in the bar in cracks and crevices, sprayed the bar ,kitchen and basement, dusted ports in the bar ceiling  Inspected all equipments, replaced monitors  Found American cockroach in monitor in the grease trap room I put nibban bait in the sewer pit"
"132465","59530","ARTHUR AND SONS NY ITALIAN LLC","38 8th Ave New York 10014","OLLIVIERRE","04/02/2024","01:57:31","SERVICE","Service: PEST ELIM MAINT Inspected all areas of the first floor, staircase and basements.  No pest activity was found during service visit.  No sanitary issues found during visit.   Checked and reset all katchalls.  Replaced glue boards and monitors throughout the entire establishment.  Cracks and crevices gel treatment throughout the entire establishment.  Fan sprayed the entire establishment basement, kitchen, first floor counter dining and bar.   Replaced 907 and halo 30 glue boards.  Updated doh."
"107866","6168","BALLATOS RESTAURANT","55 EAST HOUSTON ST NEW YORK 10012","CHOW E.","04/02/2024","01:59:35","SERVICE","Service: PEST ELIM MAINT Mouse activity found outside in alleyway inside Ketchall   Checked, cleaned, and reset Ketchalls   Crack and crevice treatment using B&G sprayer and gel bait  Spot treatment using residual and aerosols"
"131404","58472","Waku Waku","269 36th St Brooklyn 11232","BLAKAJ A.","04/02/2024","02:00:29","SERVICE","Service: PEST ELIM MAINT Upon inspecting establishment I observed no activity or signs of activity throughout the whole location. Still seeing food particles all under the appliances and some grease build up. Highly recommend that the location take extra time and clean up under the appliances behind the counter/kitchen area.   Placed traps and monitors throughout the kitchen, bar, prep area, dishwashing area, office and locker room.  Gel treated all cracks and crevices throughout the prep/storage, kitchen, bar, dishwashing area and locker room.   Inspected and serviced all traps and equipment.  Heavily treated perimeter of establishment including office, prep/storage area, kitchen, bar, dishwashing area, locker room, Dinning and bathrooms.   Signed doh but cant upload on pest pac"
"127143","54263","KETTELMANS BAGELS","456 ELIZABETH AVE SOMERSET 08873","IQBAL","04/02/2024","02:02:33","SERVICE","Service: PEST ELIM MAINT Render full general service throughout establishment perimeter. Sign doh   Talked with baker said he’s seeing mice seeing a lot   Rodent proofing required.   Rtus are clean  Ketchalsd empty only found one"
"122138","48309","Jamit Bistro","367 Columbia St Brooklyn 11231","HARRIS","04/02/2024","02:13:28","SERVICE","Service: PEST ELIM MAINT General service Upon inspection of interior and exterior areas , kitchen area, showing, minor German roach activity near sink area as well as storage area. Mice dropping in back of kitchen area along wall. Check traps reset all traps. Signed DOH sheet. See photo.  Sanitation issues : None"
"139398","66432","Serena Bistro","96 Page Ave Staten Island 10309","CAPALDI J.","04/02/2024","02:14:20","SERVICE","Service: PEST ELIM MAINT General services  Roach mice drain fly  treatment  No activity"
